{
  "applied_event_sha256": [
    "dc0e664c8402e83ceecb5a4468fc7b06fdb5317ac5baac1d0e75eea7bca38d6f",
    "de09721d8ee2aadf1cc3660b71155e2f7e026cd5beef06b9fbbb66ee2e8f99d3",
    "069b0c501038d53f31070874cd84afe994e832b89d68ffa0421e8987f64877a5",
    "3249801c80759d327f008d35f7de03fd1a574d125f3e9d3233f751121285796b",
    "7bf00972260c48608954f9c8ea723f44b72178e041e51e8ead3f888f42631d97"
  ],
  "approval_sha256": "897d93813cd0a1027d4097b07dd7d633d9991a9cbc3b21b3db79262cd21a2b5d",
  "content_sha256": "bf8bec36bdf113f55d286fddd1689d668bbee4fdd289f85ae4e2ef05fc151eee",
  "duplicate_replay_detected": true,
  "last_applied_sequence": 5,
  "plan_sha256": "17ac4f4819e3f50bca9c8867401cdd0af5aea6b67b62a57b50132ad8bf4590c7",
  "production_ready": false,
  "receipt_type": "factorydark-migration-rehearsal-checkpoint",
  "resume_count": 1,
  "schema_version": "1.0",
  "source": {
    "rows": [
      {
        "ACCT_ID": "10000000001",
        "ACQR_COUNTRY_CODE": "840",
        "APPROVED_AMT": "125.50",
        "AUTH_FRAUD": "Y",
        "AUTH_ID_CODE": "A10001",
        "AUTH_RESP_CODE": "00",
        "AUTH_RESP_REASON": "APRV",
        "AUTH_TS": "2026-08-20T10:15:30.123456",
        "AUTH_TYPE": "SALE",
        "CARD_EXPIRY_DATE": "2808",
        "CARD_NUM": "4000000000000001",
        "CUST_ID": "100000001",
        "FRAUD_RPT_DATE": "2026-08-22",
        "MATCH_STATUS": "M",
        "MERCHANT_CATAGORY_CODE": "5411",
        "MERCHANT_CITY": "SAN FRANCISCO",
        "MERCHANT_ID": "M00000000000001",
        "MERCHANT_NAME": "FactoryDark Market",
        "MERCHANT_STATE": "CA",
        "MERCHANT_ZIP": "941050000",
        "MESSAGE_SOURCE": "POS001",
        "MESSAGE_TYPE": "010000",
        "POS_ENTRY_MODE": 5,
        "PROCESSING_CODE": "000000",
        "TRANSACTION_AMT": "125.50",
        "TRANSACTION_ID": "TX0000000000001"
      },
      {
        "ACCT_ID": "10000000001",
        "ACQR_COUNTRY_CODE": "840",
        "APPROVED_AMT": "40.00",
        "AUTH_FRAUD": "N",
        "AUTH_ID_CODE": "A10003",
        "AUTH_RESP_CODE": "00",
        "AUTH_RESP_REASON": "ADJ ",
        "AUTH_TS": "2026-08-20T10:17:32.000002",
        "AUTH_TYPE": "SALE",
        "CARD_EXPIRY_DATE": "2808",
        "CARD_NUM": "4000000000000003",
        "CUST_ID": "100000001",
        "FRAUD_RPT_DATE": null,
        "MATCH_STATUS": "M",
        "MERCHANT_CATAGORY_CODE": "5411",
        "MERCHANT_CITY": "SAN FRANCISCO",
        "MERCHANT_ID": "M00000000000001",
        "MERCHANT_NAME": "FactoryDark Market",
        "MERCHANT_STATE": "CA",
        "MERCHANT_ZIP": "941050000",
        "MESSAGE_SOURCE": "POS001",
        "MESSAGE_TYPE": "010000",
        "POS_ENTRY_MODE": 5,
        "PROCESSING_CODE": "000000",
        "TRANSACTION_AMT": "42.00",
        "TRANSACTION_ID": "TX0000000000003"
      },
      {
        "ACCT_ID": "10000000002",
        "ACQR_COUNTRY_CODE": "036",
        "APPROVED_AMT": "7.25",
        "AUTH_FRAUD": "N",
        "AUTH_ID_CODE": "A10004",
        "AUTH_RESP_CODE": "00",
        "AUTH_RESP_REASON": "APRV",
        "AUTH_TS": "2026-08-20T10:18:33.000003",
        "AUTH_TYPE": "RFND",
        "CARD_EXPIRY_DATE": "2712",
        "CARD_NUM": "4000000000000004",
        "CUST_ID": null,
        "FRAUD_RPT_DATE": null,
        "MATCH_STATUS": "U",
        "MERCHANT_CATAGORY_CODE": "5999",
        "MERCHANT_CITY": "MELBOURNE",
        "MERCHANT_ID": "M00000000000002",
        "MERCHANT_NAME": "Null Name Test",
        "MERCHANT_STATE": "VI",
        "MERCHANT_ZIP": "300000000",
        "MESSAGE_SOURCE": "WEB001",
        "MESSAGE_TYPE": "010000",
        "POS_ENTRY_MODE": 81,
        "PROCESSING_CODE": "200000",
        "TRANSACTION_AMT": "7.25",
        "TRANSACTION_ID": "TX0000000000004"
      }
    ],
    "state_sha256": "a4a340d33a84971c2ea7b14dfbcdfa7e048948581c2572ea57d76a04db4fcaa5"
  },
  "status": "completed",
  "targets": {
    "oracle-26ai-free": {
      "rows": [
        {
          "ACCT_ID": "10000000001",
          "ACQR_COUNTRY_CODE": "840",
          "APPROVED_AMT": "125.50",
          "AUTH_FRAUD": "Y",
          "AUTH_ID_CODE": "A10001",
          "AUTH_RESP_CODE": "00",
          "AUTH_RESP_REASON": "APRV",
          "AUTH_TS": "2026-08-20T10:15:30.123456",
          "AUTH_TYPE": "SALE",
          "CARD_EXPIRY_DATE": "2808",
          "CARD_NUM": "4000000000000001",
          "CUST_ID": "100000001",
          "FRAUD_RPT_DATE": "2026-08-22",
          "MATCH_STATUS": "M",
          "MERCHANT_CATAGORY_CODE": "5411",
          "MERCHANT_CITY": "SAN FRANCISCO",
          "MERCHANT_ID": "M00000000000001",
          "MERCHANT_NAME": "FactoryDark Market",
          "MERCHANT_STATE": "CA",
          "MERCHANT_ZIP": "941050000",
          "MESSAGE_SOURCE": "POS001",
          "MESSAGE_TYPE": "010000",
          "POS_ENTRY_MODE": 5,
          "PROCESSING_CODE": "000000",
          "TRANSACTION_AMT": "125.50",
          "TRANSACTION_ID": "TX0000000000001"
        },
        {
          "ACCT_ID": "10000000001",
          "ACQR_COUNTRY_CODE": "840",
          "APPROVED_AMT": "40.00",
          "AUTH_FRAUD": "N",
          "AUTH_ID_CODE": "A10003",
          "AUTH_RESP_CODE": "00",
          "AUTH_RESP_REASON": "ADJ ",
          "AUTH_TS": "2026-08-20T10:17:32.000002",
          "AUTH_TYPE": "SALE",
          "CARD_EXPIRY_DATE": "2808",
          "CARD_NUM": "4000000000000003",
          "CUST_ID": "100000001",
          "FRAUD_RPT_DATE": null,
          "MATCH_STATUS": "M",
          "MERCHANT_CATAGORY_CODE": "5411",
          "MERCHANT_CITY": "SAN FRANCISCO",
          "MERCHANT_ID": "M00000000000001",
          "MERCHANT_NAME": "FactoryDark Market",
          "MERCHANT_STATE": "CA",
          "MERCHANT_ZIP": "941050000",
          "MESSAGE_SOURCE": "POS001",
          "MESSAGE_TYPE": "010000",
          "POS_ENTRY_MODE": 5,
          "PROCESSING_CODE": "000000",
          "TRANSACTION_AMT": "42.00",
          "TRANSACTION_ID": "TX0000000000003"
        },
        {
          "ACCT_ID": "10000000002",
          "ACQR_COUNTRY_CODE": "036",
          "APPROVED_AMT": "7.25",
          "AUTH_FRAUD": "N",
          "AUTH_ID_CODE": "A10004",
          "AUTH_RESP_CODE": "00",
          "AUTH_RESP_REASON": "APRV",
          "AUTH_TS": "2026-08-20T10:18:33.000003",
          "AUTH_TYPE": "RFND",
          "CARD_EXPIRY_DATE": "2712",
          "CARD_NUM": "4000000000000004",
          "CUST_ID": null,
          "FRAUD_RPT_DATE": null,
          "MATCH_STATUS": "U",
          "MERCHANT_CATAGORY_CODE": "5999",
          "MERCHANT_CITY": "MELBOURNE",
          "MERCHANT_ID": "M00000000000002",
          "MERCHANT_NAME": "Null Name Test",
          "MERCHANT_STATE": "VI",
          "MERCHANT_ZIP": "300000000",
          "MESSAGE_SOURCE": "WEB001",
          "MESSAGE_TYPE": "010000",
          "POS_ENTRY_MODE": 81,
          "PROCESSING_CODE": "200000",
          "TRANSACTION_AMT": "7.25",
          "TRANSACTION_ID": "TX0000000000004"
        }
      ],
      "state_sha256": "a4a340d33a84971c2ea7b14dfbcdfa7e048948581c2572ea57d76a04db4fcaa5"
    },
    "postgresql-16": {
      "rows": [
        {
          "acct_id": "10000000001",
          "acqr_country_code": "840",
          "approved_amt": "125.50",
          "auth_fraud": "Y",
          "auth_id_code": "A10001",
          "auth_resp_code": "00",
          "auth_resp_reason": "APRV",
          "auth_ts": "2026-08-20T10:15:30.123456",
          "auth_type": "SALE",
          "card_expiry_date": "2808",
          "card_num": "4000000000000001",
          "cust_id": "100000001",
          "fraud_rpt_date": "2026-08-22",
          "match_status": "M",
          "merchant_catagory_code": "5411",
          "merchant_city": "SAN FRANCISCO",
          "merchant_id": "M00000000000001",
          "merchant_name": "FactoryDark Market",
          "merchant_state": "CA",
          "merchant_zip": "941050000",
          "message_source": "POS001",
          "message_type": "010000",
          "pos_entry_mode": 5,
          "processing_code": "000000",
          "transaction_amt": "125.50",
          "transaction_id": "TX0000000000001"
        },
        {
          "acct_id": "10000000001",
          "acqr_country_code": "840",
          "approved_amt": "40.00",
          "auth_fraud": "N",
          "auth_id_code": "A10003",
          "auth_resp_code": "00",
          "auth_resp_reason": "ADJ ",
          "auth_ts": "2026-08-20T10:17:32.000002",
          "auth_type": "SALE",
          "card_expiry_date": "2808",
          "card_num": "4000000000000003",
          "cust_id": "100000001",
          "fraud_rpt_date": null,
          "match_status": "M",
          "merchant_catagory_code": "5411",
          "merchant_city": "SAN FRANCISCO",
          "merchant_id": "M00000000000001",
          "merchant_name": "FactoryDark Market",
          "merchant_state": "CA",
          "merchant_zip": "941050000",
          "message_source": "POS001",
          "message_type": "010000",
          "pos_entry_mode": 5,
          "processing_code": "000000",
          "transaction_amt": "42.00",
          "transaction_id": "TX0000000000003"
        },
        {
          "acct_id": "10000000002",
          "acqr_country_code": "036",
          "approved_amt": "7.25",
          "auth_fraud": "N",
          "auth_id_code": "A10004",
          "auth_resp_code": "00",
          "auth_resp_reason": "APRV",
          "auth_ts": "2026-08-20T10:18:33.000003",
          "auth_type": "RFND",
          "card_expiry_date": "2712",
          "card_num": "4000000000000004",
          "cust_id": null,
          "fraud_rpt_date": null,
          "match_status": "U",
          "merchant_catagory_code": "5999",
          "merchant_city": "MELBOURNE",
          "merchant_id": "M00000000000002",
          "merchant_name": "Null Name Test",
          "merchant_state": "VI",
          "merchant_zip": "300000000",
          "message_source": "WEB001",
          "message_type": "010000",
          "pos_entry_mode": 81,